{
  "approvalId": "urn:missionweave:approval:mission-one-revision-nine",
  "kind": "mission_final",
  "decision": "approved",
  "missionId": "urn:missionweave:mission:one",
  "groupId": "urn:missionweave:group:mission-one",
  "missionRevision": 9,
  "artifactHashes": ["sha256:aaaaaaaaaaaaaaaaaaaaaaaaaaaaaaaaaaaaaaaaaaaaaaaaaaaaaaaaaaaaaaaa"],
  "acceptancePolicyVersion": "1.2.0",
  "approver": {"type": "human", "id": "urn:missionweave:human:mission-owner"},
  "comments": "Acceptance criteria and evidence reviewed.",
  "conditions": [],
  "occurredAt": "2026-07-15T04:00:00Z",
  "signature": {
    "algorithm": "Ed25519",
    "keyId": "urn:missionweave:key:mission-owner",
    "createdAt": "2026-07-15T04:00:00Z",
    "value": "c2lnbmF0dXJl"
  }
}
